export const SubAdminData = [
  // {
  //   path: "/crear-blog",
  //   title: "Crear Blog",
  //   icon: "FilePlus2",
  // },
  // {
  //   path: "/actualizar-blog",
  //   title: "Modificar Blog",
  //   icon: "PenLine",
  // },
  // {
  //   path: "/eliminar-blog",
  //   title: "Eliminar Blog",
  //   icon: "Trash2",
  // },
  {
    path: "/crear-curso",
    title: "Crear Curso",
    icon: "FilePlus2",
  },
  {
    path: "/actualizar-curso",
    title: "Modificar Curso",
    icon: "PenLine",
  },
  {
    path: "/eliminar-curso",
    title: "Eliminar Curso",
    icon: "Trash2",
  },
  {
    path: "/crear-video-curso",
    title: "Agregar Videos a Curso",
    icon: "FilePlus2",
  },
  {
    path: "/actualizar-video-curso",
    title: "Modificar Videos de un Curso",
    icon: "PenLine",
  },
  {
    path: "/eliminar-video-curso",
    title: "Eliminar Videos de un Curso",
    icon: "Trash2",
  },
  {
    path: "/agregar-estFin",
    title: "Agregar Estado Financiero",
    icon: "FilePlus2",
  },
  {
    path: "/modificar-estFin",
    title: "Modificar Estado Financiero",
    icon: "PenLine",
  },
  {
    path: "/eliminar-estFin",
    title: "Eliminar Estado Financiero",
    icon: "Trash2",
  },
];

export const AdminData = [
  {
    path: "/crear-cliente",
    title: "Crear Nuevo Cliente",
    icon: "FilePlus2",
  },
  {
    path: "/actualizar-cliente",
    title: "Actualizar Cliente",
    icon: "PenLine",
  },
  {
    path: "/eliminar-cliente",
    title: "Eliminar Cliente",
    icon: "Trash2",
  },
];

export const meses = [
  "enero",
  "febrero",
  "marzo",
  "abril",
  "mayo",
  "junio",
  "julio",
  "agosto",
  "septiembre",
  "octubre",
  "noviembre",
  "diciembre",
];

export const PreguntasFrecuentesData = [
  {
    pregunta: "¿Qué necesito para empezar?",
    respuesta:
      "Solo requieres tu RFC y CIEC (contraseña de acceso al SAT), con ella iniciaremos realizando un diagnóstico de tu situación fiscal y el proceso a seguir para regularizarte ante el SAT, esto en una reunión 1 a 1 en línea vía zoom. En caso de no contar con tu contraseña, nosotros te brindamos la asesoría para obtenerla.",
  },
  {
    pregunta: "¿Por qué elegir EasySAT?",
    respuesta:
    [
      '1.- Somos un despacho de contadores certificados con más de 10 años de experiencia.',
      '2.- Nuestra tecnología te brindará un servicio más confiable y eficiente.',
      '3.- Te daremos cursos de actualización en temas fiscales.',
    ]
  },
  {
    pregunta: "¿Cómo hablo con un contador si todo es en línea?",
    respuesta:
      "Se te asignará un contador con el cual podrás tener acceso a una agenda de juntas periódicas, así como la atención vía WhatsApp para rápida consulta.",
  },
  {
    pregunta: "¿Mi información estará protegida?",
    respuesta:
      "Si, cuando envías tus datos por esta página, te enviamos nuestro aviso de privacidad, dando buen uso a toda la información que nos otorgas.",
  },
  {
    pregunta: "Si no me gusto el servicio, ¿Puedo cancelar?",
    respuesta:
      "Claro que sí, puedes cancelar el servicio en el momento que requieras, ya que no contamos con plazos forzosos.",
  },
];

export const OpinionesClientes = [
  {
    imgUrl: "https://i.pinimg.com/564x/bc/5a/86/bc5a8680fd18d355fd15ef1331e08d55.jpg",
    nombre: "Javier Escobedo",
    cargo: "Nutriólogo",
    msg: `Desde que contrate EasySAT, el cumplir con mis obligaciones fiscales dejo de ser un problema.`,
  },
  {
    imgUrl: "https://i.pinimg.com/564x/cc/0b/5a/cc0b5a46bb3335e22f09f7e981c07ae1.jpg",
    nombre: "Ricardo Mier",
    cargo: "Arquitecto",
    msg: `Con EasySAT siempre estoy actualizado en temas fiscales, los impuestos se han vuelto realmente sencillos con la asesoría de mi contador asigando.`,
  },
  {
    imgUrl: "https://i.pinimg.com/564x/db/a8/62/dba862849c0550a89cce67a6e582e21d.jpg",
    nombre: "Judith Cantu",
    cargo: "Vendedora de ML y Amazon",
    msg: `Con tantos cambios fiscales a los emprendedores nos da temor no cumplir de forma correcta, EasySAT me da la tranquilidad que necesito para yo enfocarme en mi negocio y olvidarme de temas fiscales.`,
  },
];

export function ordenarPorMes(data) {
  // Función de comparación personalizada
  function compararPorMes(a, b) {
    const mesA = meses.indexOf(a.name.toLowerCase());
    const mesB = meses.indexOf(b.name.toLowerCase());

    if (mesA < mesB) {
      return -1;
    }
    if (mesA > mesB) {
      return 1;
    }
    return 0;
  }

  // Ordenar la data utilizando la función de comparación
  const dataOrdenada = data?.sort(compararPorMes);

  return dataOrdenada;
}

export const getDataMes = (data, mes) => {
  return data?.filter(
    (item) => item?.name?.toLowerCase() === mes?.toLowerCase()
  );
};

export const emitidasPrueba = [
  {
      "verificado_ó_asoc.": "",
      "estado_sat": "Vigente",
      "version": "4.0",
      "tipo": "Factura",
      "fecha_emision": "03/11/2023",
      "fecha_timbrado": "2023-11-03T13:53:18",
      "estadopago": "",
      "fechapago": "",
      "serie": "B",
      "folio": "754",
      "uuid": "0DFD0BF3-6AFC-44B8-B45C-29D041877ADD",
      "uuid_relacion": "",
      "rfc_emisor": "GOMS651015HB4",
      "nombre_emisor": "SERGIO GOMEZ MARTINEZ",
      "lugardeexpedicion": "22230",
      "rfc_receptor": "DFL9508025N4",
      "nombre_receptor": "DISTRIBUIDORA EL FLORIDO",
      "residenciafiscal": "",
      "numregidtrib": "",
      "usocfdi": "G03 - Gastos en general",
      "subtotal": 53440,
      "descuento": 0,
      "total_ieps": 0,
      "iva_16%": 8550.4,
      "retenido_iva": 0,
      "retenido_isr": 0,
      "ish": 0,
      "total": 61990.4,
      "totaloriginal": "",
      "total_trasladados": 8550.4,
      "total_retenidos": 0,
      "total_localtrasladado": 0,
      "total_localretenido": 0,
      "complemento": "",
      "moneda": "MXN",
      "tipo_de_cambio": "1",
      "formadepago": "03 - Transferencia electrónica de fondos",
      "metodo_de_pago": "PUE - Pago en una sola exhibición",
      "numctapago": "",
      "condicion_de_pago": "",
      "conceptos": "ANTICIPO DEL 50% POR SISTEMA DE ENERGÍA ININTERRUMPIBLE (UPS) MARCA POWERWARE SERIES 9PX CON CAPACIDAD DE 6000 VA/5400 W. INCLUYE BATERÍAS SELLADAS LIBRES DE MANTENIMIENTO ADECUADAS PARA PROPORCIONAR 100% DE CARGA. * ",
      "combustible": "No",
      "ieps_3%": "0",
      "ieps_6%": "0",
      "ieps_7%": "0",
      "ieps_8%": "0",
      "ieps_9%": "0",
      "ieps_26.5%": "0",
      "ieps_30%": "0",
      "ieps_53%": "0",
      "ieps_160%": "0",
      "archivo_xml": "0DFD0BF3-6AFC-44B8-B45C-29D041877ADD@1000000000XX0.xml",
      "direccion_emisor": "    ",
      "localidad_emisor": " ",
      "direccion_receptor": "    ",
      "localidad_receptor": " ",
      "iva_8%": 0,
      "ieps_30.4%": "0",
      "iva_ret_6%": "0",
      "regimenfiscalreceptor": "601 - General de Ley Personas Morales",
      "domiciliofiscalreceptor": "22000"
  },
  {
      "verificado_ó_asoc.": "",
      "estado_sat": "Vigente",
      "version": "4.0",
      "tipo": "Factura",
      "fecha_emision": "08/11/2023",
      "fecha_timbrado": "2023-11-08T19:33:58",
      "estadopago": "",
      "fechapago": "",
      "serie": "B",
      "folio": "761",
      "uuid": "52902025-E7E5-4C55-AD28-8C62A24ECBB5",
      "uuid_relacion": "",
      "rfc_emisor": "GOMS651015HB4",
      "nombre_emisor": "SERGIO GOMEZ MARTINEZ",
      "lugardeexpedicion": "22230",
      "rfc_receptor": "UNA2907227Y5",
      "nombre_receptor": "UNIVERSIDAD NACIONAL AUTONOMA DE MEXICO",
      "residenciafiscal": "",
      "numregidtrib": "",
      "usocfdi": "G03 - Gastos en general",
      "subtotal": 17000,
      "descuento": 0,
      "total_ieps": 0,
      "iva_16%": 2720,
      "retenido_iva": 0,
      "retenido_isr": 0,
      "ish": 0,
      "total": 19720,
      "totaloriginal": "",
      "total_trasladados": 2720,
      "total_retenidos": 0,
      "total_localtrasladado": 0,
      "total_localretenido": 0,
      "complemento": "",
      "moneda": "MXN",
      "tipo_de_cambio": "1",
      "formadepago": "99 - Por definir",
      "metodo_de_pago": "PPD - Pago en parcialidades o diferido",
      "numctapago": "",
      "condicion_de_pago": "",
      "conceptos": "SERVICIO DE REVISION A EQUIPO UPS 9390 EN PARALELO * SERVICIO DE CONFIGURACION DE PARAMETROS DEL PARALELO MEDIANTE XCP TOOL * ",
      "combustible": "No",
      "ieps_3%": "0",
      "ieps_6%": "0",
      "ieps_7%": "0",
      "ieps_8%": "0",
      "ieps_9%": "0",
      "ieps_26.5%": "0",
      "ieps_30%": "0",
      "ieps_53%": "0",
      "ieps_160%": "0",
      "archivo_xml": "52902025-E7E5-4C55-AD28-8C62A24ECBB5@1000000000XX0.xml",
      "direccion_emisor": "    ",
      "localidad_emisor": " ",
      "direccion_receptor": "    ",
      "localidad_receptor": " ",
      "iva_8%": 0,
      "ieps_30.4%": "0",
      "iva_ret_6%": "0",
      "regimenfiscalreceptor": "603 - Personas Morales con Fines no Lucrativos",
      "domiciliofiscalreceptor": "04510"
  },
  {
      "verificado_ó_asoc.": "",
      "estado_sat": "Vigente",
      "version": "4.0",
      "tipo": "Factura",
      "fecha_emision": "10/11/2023",
      "fecha_timbrado": "2023-11-10T21:29:26",
      "estadopago": "",
      "fechapago": "",
      "serie": "B",
      "folio": "762",
      "uuid": "8194DD88-8B67-4767-91AE-19F5EA0F38F9",
      "uuid_relacion": "",
      "rfc_emisor": "GOMS651015HB4",
      "nombre_emisor": "SERGIO GOMEZ MARTINEZ",
      "lugardeexpedicion": "22230",
      "rfc_receptor": "DFL9508025N4",
      "nombre_receptor": "DISTRIBUIDORA EL FLORIDO",
      "residenciafiscal": "",
      "numregidtrib": "",
      "usocfdi": "G03 - Gastos en general",
      "subtotal": 6000,
      "descuento": 0,
      "total_ieps": 0,
      "iva_16%": 960,
      "retenido_iva": 0,
      "retenido_isr": 0,
      "ish": 0,
      "total": 6960,
      "totaloriginal": "",
      "total_trasladados": 960,
      "total_retenidos": 0,
      "total_localtrasladado": 0,
      "total_localretenido": 0,
      "complemento": "",
      "moneda": "MXN",
      "tipo_de_cambio": "1",
      "formadepago": "99 - Por definir",
      "metodo_de_pago": "PPD - Pago en parcialidades o diferido",
      "numctapago": "",
      "condicion_de_pago": "",
      "conceptos": "REVISION DE EQUIPO UPS SUCURSAL COLINAS DE LA PRESA ENSENADA * ",
      "combustible": "No",
      "ieps_3%": "0",
      "ieps_6%": "0",
      "ieps_7%": "0",
      "ieps_8%": "0",
      "ieps_9%": "0",
      "ieps_26.5%": "0",
      "ieps_30%": "0",
      "ieps_53%": "0",
      "ieps_160%": "0",
      "archivo_xml": "8194DD88-8B67-4767-91AE-19F5EA0F38F9@1000000000XX0.xml",
      "direccion_emisor": "    ",
      "localidad_emisor": " ",
      "direccion_receptor": "    ",
      "localidad_receptor": " ",
      "iva_8%": 0,
      "ieps_30.4%": "0",
      "iva_ret_6%": "0",
      "regimenfiscalreceptor": "601 - General de Ley Personas Morales",
      "domiciliofiscalreceptor": "22000"
  },
  {
      "verificado_ó_asoc.": "",
      "estado_sat": "Vigente",
      "version": "4.0",
      "tipo": "Factura",
      "fecha_emision": "03/11/2023",
      "fecha_timbrado": "2023-11-03T13:55:35",
      "estadopago": "",
      "fechapago": "",
      "serie": "B",
      "folio": "755",
      "uuid": "9BFF628D-B1D2-482C-B651-3BEECC594E8D",
      "uuid_relacion": "",
      "rfc_emisor": "GOMS651015HB4",
      "nombre_emisor": "SERGIO GOMEZ MARTINEZ",
      "lugardeexpedicion": "22230",
      "rfc_receptor": "DFL9508025N4",
      "nombre_receptor": "DISTRIBUIDORA EL FLORIDO",
      "residenciafiscal": "",
      "numregidtrib": "",
      "usocfdi": "G03 - Gastos en general",
      "subtotal": 54040,
      "descuento": 0,
      "total_ieps": 0,
      "iva_16%": 8646.4,
      "retenido_iva": 0,
      "retenido_isr": 0,
      "ish": 0,
      "total": 62686.4,
      "totaloriginal": "",
      "total_trasladados": 8646.4,
      "total_retenidos": 0,
      "total_localtrasladado": 0,
      "total_localretenido": 0,
      "complemento": "",
      "moneda": "MXN",
      "tipo_de_cambio": "1",
      "formadepago": "03 - Transferencia electrónica de fondos",
      "metodo_de_pago": "PUE - Pago en una sola exhibición",
      "numctapago": "",
      "condicion_de_pago": "",
      "conceptos": "ANTICIPO DEL 50% POR SISTEMA DE ENERGÍA ININTERRUMPIBLE (UPS) MARCA POWERWARE SERIES 9PX CON CAPACIDAD DE 6000 VA/5400 W. INCLUYE BATERÍAS SELLADAS LIBRES DE MANTENIMIENTO ADECUADAS PARA PROPORCIONAR 100% DE CARGA. * ",
      "combustible": "No",
      "ieps_3%": "0",
      "ieps_6%": "0",
      "ieps_7%": "0",
      "ieps_8%": "0",
      "ieps_9%": "0",
      "ieps_26.5%": "0",
      "ieps_30%": "0",
      "ieps_53%": "0",
      "ieps_160%": "0",
      "archivo_xml": "9BFF628D-B1D2-482C-B651-3BEECC594E8D@1000000000XX0.xml",
      "direccion_emisor": "    ",
      "localidad_emisor": " ",
      "direccion_receptor": "    ",
      "localidad_receptor": " ",
      "iva_8%": 0,
      "ieps_30.4%": "0",
      "iva_ret_6%": "0",
      "regimenfiscalreceptor": "601 - General de Ley Personas Morales",
      "domiciliofiscalreceptor": "22000"
  },
  {
      "verificado_ó_asoc.": "",
      "estado_sat": "Vigente",
      "version": "4.0",
      "tipo": "Factura",
      "fecha_emision": "2023-11-16T18:03:24",
      "fecha_timbrado": "2023-11-16T18:03:24",
      "estadopago": "",
      "fechapago": "",
      "serie": "B",
      "folio": "763",
      "uuid": "B39114B5-4B1E-44CF-B8BB-0FDD364C3B54",
      "uuid_relacion": "",
      "rfc_emisor": "GOMS651015HB4",
      "nombre_emisor": "SERGIO GOMEZ MARTINEZ",
      "lugardeexpedicion": "22230",
      "rfc_receptor": "DFL9508025N4",
      "nombre_receptor": "DISTRIBUIDORA EL FLORIDO",
      "residenciafiscal": "",
      "numregidtrib": "",
      "usocfdi": "G03 - Gastos en general",
      "subtotal": 4800,
      "descuento": 0,
      "total_ieps": 0,
      "iva_16%": 768,
      "retenido_iva": 0,
      "retenido_isr": 0,
      "ish": 0,
      "total": 5568,
      "totaloriginal": "",
      "total_trasladados": 768,
      "total_retenidos": 0,
      "total_localtrasladado": 0,
      "total_localretenido": 0,
      "complemento": "",
      "moneda": "MXN",
      "tipo_de_cambio": "1",
      "formadepago": "99 - Por definir",
      "metodo_de_pago": "PPD - Pago en parcialidades o diferido",
      "numctapago": "",
      "condicion_de_pago": "",
      "conceptos": "MANTENIMIENTO DE EQUIPO UPS SUCURSAL VILLAS DEL CAMPO * ",
      "combustible": "No",
      "ieps_3%": "0",
      "ieps_6%": "0",
      "ieps_7%": "0",
      "ieps_8%": "0",
      "ieps_9%": "0",
      "ieps_26.5%": "0",
      "ieps_30%": "0",
      "ieps_53%": "0",
      "ieps_160%": "0",
      "archivo_xml": "B39114B5-4B1E-44CF-B8BB-0FDD364C3B54@1000000000XX0.xml",
      "direccion_emisor": "    ",
      "localidad_emisor": " ",
      "direccion_receptor": "    ",
      "localidad_receptor": " ",
      "iva_8%": 0,
      "ieps_30.4%": "0",
      "iva_ret_6%": "0",
      "regimenfiscalreceptor": "601 - General de Ley Personas Morales",
      "domiciliofiscalreceptor": "22000"
  },
  {
      "verificado_ó_asoc.": "",
      "estado_sat": "Vigente",
      "version": "4.0",
      "tipo": "Factura",
      "fecha_emision": "06/11/2023",
      "fecha_timbrado": "2023-11-06T19:37:50",
      "estadopago": "",
      "fechapago": "",
      "serie": "B",
      "folio": "760",
      "uuid": "DA3D459D-6B88-4305-B88E-30D79A27DCA7",
      "uuid_relacion": "",
      "rfc_emisor": "GOMS651015HB4",
      "nombre_emisor": "SERGIO GOMEZ MARTINEZ",
      "lugardeexpedicion": "22230",
      "rfc_receptor": "DLO160817475",
      "nombre_receptor": "DFL LOGISTICS",
      "residenciafiscal": "",
      "numregidtrib": "",
      "usocfdi": "G03 - Gastos en general",
      "subtotal": 5000,
      "descuento": 0,
      "total_ieps": 0,
      "iva_16%": 800,
      "retenido_iva": 0,
      "retenido_isr": 0,
      "ish": 0,
      "total": 5800,
      "totaloriginal": "",
      "total_trasladados": 800,
      "total_retenidos": 0,
      "total_localtrasladado": 0,
      "total_localretenido": 0,
      "complemento": "",
      "moneda": "MXN",
      "tipo_de_cambio": "1",
      "formadepago": "99 - Por definir",
      "metodo_de_pago": "PPD - Pago en parcialidades o diferido",
      "numctapago": "",
      "condicion_de_pago": "",
      "conceptos": "RENTA DE EQUIPO UPS CEDI EL LAGO * ",
      "combustible": "No",
      "ieps_3%": "0",
      "ieps_6%": "0",
      "ieps_7%": "0",
      "ieps_8%": "0",
      "ieps_9%": "0",
      "ieps_26.5%": "0",
      "ieps_30%": "0",
      "ieps_53%": "0",
      "ieps_160%": "0",
      "archivo_xml": "DA3D459D-6B88-4305-B88E-30D79A27DCA7@1000000000XX0.xml",
      "direccion_emisor": "    ",
      "localidad_emisor": " ",
      "direccion_receptor": "    ",
      "localidad_receptor": " ",
      "iva_8%": 0,
      "ieps_30.4%": "0",
      "iva_ret_6%": "0",
      "regimenfiscalreceptor": "601 - General de Ley Personas Morales",
      "domiciliofiscalreceptor": "22660"
  },
  {
      "verificado_ó_asoc.": "",
      "estado_sat": "Vigente",
      "version": "4.0",
      "tipo": "Factura",
      "fecha_emision": "16/11/2023",
      "fecha_timbrado": "2023-11-16T18:15:48",
      "estadopago": "",
      "fechapago": "",
      "serie": "B",
      "folio": "764",
      "uuid": "DCBE8B2A-613C-4176-A302-8D108E304A43",
      "uuid_relacion": "",
      "rfc_emisor": "GOMS651015HB4",
      "nombre_emisor": "SERGIO GOMEZ MARTINEZ",
      "lugardeexpedicion": "22230",
      "rfc_receptor": "DFL9508025N4",
      "nombre_receptor": "DISTRIBUIDORA EL FLORIDO",
      "residenciafiscal": "",
      "numregidtrib": "",
      "usocfdi": "G03 - Gastos en general",
      "subtotal": 9495,
      "descuento": 0,
      "total_ieps": 0,
      "iva_16%": 1519.2,
      "retenido_iva": 0,
      "retenido_isr": 0,
      "ish": 0,
      "total": 11014.2,
      "totaloriginal": "",
      "total_trasladados": 1519.2,
      "total_retenidos": 0,
      "total_localtrasladado": 0,
      "total_localretenido": 0,
      "complemento": "",
      "moneda": "MXN",
      "tipo_de_cambio": "1",
      "formadepago": "99 - Por definir",
      "metodo_de_pago": "PPD - Pago en parcialidades o diferido",
      "numctapago": "",
      "condicion_de_pago": "",
      "conceptos": "SUMINISTRO DE TARJETA DE CONTROL NETWORK PARA MONITOREO DE EQUIPO UPS 9PX 6KVA SUCURSAL EJIDO PUEBLA MEXICALI * ",
      "combustible": "No",
      "ieps_3%": "0",
      "ieps_6%": "0",
      "ieps_7%": "0",
      "ieps_8%": "0",
      "ieps_9%": "0",
      "ieps_26.5%": "0",
      "ieps_30%": "0",
      "ieps_53%": "0",
      "ieps_160%": "0",
      "archivo_xml": "DCBE8B2A-613C-4176-A302-8D108E304A43@1000000000XX0.xml",
      "direccion_emisor": "    ",
      "localidad_emisor": " ",
      "direccion_receptor": "    ",
      "localidad_receptor": " ",
      "iva_8%": 0,
      "ieps_30.4%": "0",
      "iva_ret_6%": "0",
      "regimenfiscalreceptor": "601 - General de Ley Personas Morales",
      "domiciliofiscalreceptor": "22000"
  },
  {
      "verificado_ó_asoc.": "",
      "estado_sat": "Cancelado",
      "version": "4.0",
      "tipo": "Factura",
      "fecha_emision": "05/11/2023",
      "fecha_timbrado": "2023-11-05T17:19:35",
      "estadopago": "",
      "fechapago": "",
      "serie": "B",
      "folio": "758",
      "uuid": "10AF853B-2D88-4E9D-8969-0B68C0DB653E",
      "uuid_relacion": "",
      "rfc_emisor": "GOMS651015HB4",
      "nombre_emisor": "SERGIO GOMEZ MARTINEZ",
      "lugardeexpedicion": "22230",
      "rfc_receptor": "DFL9508025N4",
      "nombre_receptor": "DISTRIBUIDORA EL FLORIDO",
      "residenciafiscal": "",
      "numregidtrib": "",
      "usocfdi": "G03 - Gastos en general",
      "subtotal": 5000,
      "descuento": 0,
      "total_ieps": 0,
      "iva_16%": 800,
      "retenido_iva": 0,
      "retenido_isr": 0,
      "ish": 0,
      "total": 5800,
      "totaloriginal": "",
      "total_trasladados": 800,
      "total_retenidos": 0,
      "total_localtrasladado": 0,
      "total_localretenido": 0,
      "complemento": "",
      "moneda": "MXN",
      "tipo_de_cambio": "1",
      "formadepago": "99 - Por definir",
      "metodo_de_pago": "PPD - Pago en parcialidades o diferido",
      "numctapago": "",
      "condicion_de_pago": "",
      "conceptos": "RENTA DE EQUIPO UPS CEDI EL LAGO * ",
      "combustible": "No",
      "ieps_3%": "0",
      "ieps_6%": "0",
      "ieps_7%": "0",
      "ieps_8%": "0",
      "ieps_9%": "0",
      "ieps_26.5%": "0",
      "ieps_30%": "0",
      "ieps_53%": "0",
      "ieps_160%": "0",
      "archivo_xml": "10AF853B-2D88-4E9D-8969-0B68C0DB653E@2000000000XX0.xml",
      "direccion_emisor": "    ",
      "localidad_emisor": " ",
      "direccion_receptor": "    ",
      "localidad_receptor": " ",
      "iva_8%": 0,
      "ieps_30.4%": "0",
      "iva_ret_6%": "0",
      "regimenfiscalreceptor": "601 - General de Ley Personas Morales",
      "domiciliofiscalreceptor": "22000"
  },
  {
      "verificado_ó_asoc.": "",
      "estado_sat": "Cancelado",
      "version": "4.0",
      "tipo": "Factura",
      "fecha_emision": "03/11/2023",
      "fecha_timbrado": "2023-11-03T17:07:43",
      "estadopago": "",
      "fechapago": "",
      "serie": "B",
      "folio": "756",
      "uuid": "9C37BE14-6B2D-4FEA-8DC9-C410E9EDE307",
      "uuid_relacion": "",
      "rfc_emisor": "GOMS651015HB4",
      "nombre_emisor": "SERGIO GOMEZ MARTINEZ",
      "lugardeexpedicion": "22230",
      "rfc_receptor": "SDI861110768",
      "nombre_receptor": "SISTEMA PARA EL DESARROLLO INTEGRAL DE LA FAMILIA DE BAJA CALIFORNIA",
      "residenciafiscal": "",
      "numregidtrib": "",
      "usocfdi": "G03 - Gastos en general",
      "subtotal": 5000,
      "descuento": 0,
      "total_ieps": 0,
      "iva_16%": 800,
      "retenido_iva": 0,
      "retenido_isr": 0,
      "ish": 0,
      "total": 5800,
      "totaloriginal": "",
      "total_trasladados": 800,
      "total_retenidos": 0,
      "total_localtrasladado": 0,
      "total_localretenido": 0,
      "complemento": "",
      "moneda": "MXN",
      "tipo_de_cambio": "1",
      "formadepago": "01 - Efectivo",
      "metodo_de_pago": "PUE - Pago en una sola exhibición",
      "numctapago": "",
      "condicion_de_pago": "",
      "conceptos": "Baterías Panasonic 12 v 33 amperes * ",
      "combustible": "No",
      "ieps_3%": "0",
      "ieps_6%": "0",
      "ieps_7%": "0",
      "ieps_8%": "0",
      "ieps_9%": "0",
      "ieps_26.5%": "0",
      "ieps_30%": "0",
      "ieps_53%": "0",
      "ieps_160%": "0",
      "archivo_xml": "9C37BE14-6B2D-4FEA-8DC9-C410E9EDE307@2000000000XX0.xml",
      "direccion_emisor": "    ",
      "localidad_emisor": " ",
      "direccion_receptor": "    ",
      "localidad_receptor": " ",
      "iva_8%": 0,
      "ieps_30.4%": "0",
      "iva_ret_6%": "0",
      "regimenfiscalreceptor": "603 - Personas Morales con Fines no Lucrativos",
      "domiciliofiscalreceptor": "21100"
  },
  {
      "verificado_ó_asoc.": "",
      "estado_sat": "Cancelado",
      "version": "4.0",
      "tipo": "Factura",
      "fecha_emision": "05/11/2023",
      "fecha_timbrado": "2023-11-05T17:25:32",
      "estadopago": "",
      "fechapago": "",
      "serie": "B",
      "folio": "759",
      "uuid": "F783C12A-3B7C-4378-ACA1-C68A4B985702",
      "uuid_relacion": "",
      "rfc_emisor": "GOMS651015HB4",
      "nombre_emisor": "SERGIO GOMEZ MARTINEZ",
      "lugardeexpedicion": "22230",
      "rfc_receptor": "DFL9508025N4",
      "nombre_receptor": "DISTRIBUIDORA EL FLORIDO",
      "residenciafiscal": "",
      "numregidtrib": "",
      "usocfdi": "G03 - Gastos en general",
      "subtotal": 6000,
      "descuento": 0,
      "total_ieps": 0,
      "iva_16%": 960,
      "retenido_iva": 0,
      "retenido_isr": 0,
      "ish": 0,
      "total": 6960,
      "totaloriginal": "",
      "total_trasladados": 960,
      "total_retenidos": 0,
      "total_localtrasladado": 0,
      "total_localretenido": 0,
      "complemento": "",
      "moneda": "MXN",
      "tipo_de_cambio": "1",
      "formadepago": "99 - Por definir",
      "metodo_de_pago": "PPD - Pago en parcialidades o diferido",
      "numctapago": "",
      "condicion_de_pago": "",
      "conceptos": "REVISION DE EQUIPO UPS SUCURSAL COLINAS DE LA PRESA ENSENADA * ",
      "combustible": "No",
      "ieps_3%": "0",
      "ieps_6%": "0",
      "ieps_7%": "0",
      "ieps_8%": "0",
      "ieps_9%": "0",
      "ieps_26.5%": "0",
      "ieps_30%": "0",
      "ieps_53%": "0",
      "ieps_160%": "0",
      "archivo_xml": "F783C12A-3B7C-4378-ACA1-C68A4B985702@2000000000XX0.xml",
      "direccion_emisor": "    ",
      "localidad_emisor": " ",
      "direccion_receptor": "    ",
      "localidad_receptor": " ",
      "iva_8%": 0,
      "ieps_30.4%": "0",
      "iva_ret_6%": "0",
      "regimenfiscalreceptor": "601 - General de Ley Personas Morales",
      "domiciliofiscalreceptor": "22000"
  },
  {
      "verificado_ó_asoc.": "",
      "estado_sat": "Cancelado",
      "version": "4.0",
      "tipo": "Factura",
      "fecha_emision": "03/11/2023",
      "fecha_timbrado": "2023-11-03T17:14:48",
      "estadopago": "",
      "fechapago": "",
      "serie": "B",
      "folio": "757",
      "uuid": "F98C4F8C-0037-4388-B9EB-E9DDDCE2D893",
      "uuid_relacion": "",
      "rfc_emisor": "GOMS651015HB4",
      "nombre_emisor": "SERGIO GOMEZ MARTINEZ",
      "lugardeexpedicion": "22230",
      "rfc_receptor": "SDI861110768",
      "nombre_receptor": "SISTEMA PARA EL DESARROLLO INTEGRAL DE LA FAMILIA DE BAJA CALIFORNIA",
      "residenciafiscal": "",
      "numregidtrib": "",
      "usocfdi": "G03 - Gastos en general",
      "subtotal": 5000,
      "descuento": 0,
      "total_ieps": 0,
      "iva_16%": 800,
      "retenido_iva": 0,
      "retenido_isr": 0,
      "ish": 0,
      "total": 5800,
      "totaloriginal": "",
      "total_trasladados": 800,
      "total_retenidos": 0,
      "total_localtrasladado": 0,
      "total_localretenido": 0,
      "complemento": "",
      "moneda": "MXN",
      "tipo_de_cambio": "1",
      "formadepago": "01 - Efectivo",
      "metodo_de_pago": "PUE - Pago en una sola exhibición",
      "numctapago": "",
      "condicion_de_pago": "",
      "conceptos": "Baterías Panasonic 12 v 33 amperes * ",
      "combustible": "No",
      "ieps_3%": "0",
      "ieps_6%": "0",
      "ieps_7%": "0",
      "ieps_8%": "0",
      "ieps_9%": "0",
      "ieps_26.5%": "0",
      "ieps_30%": "0",
      "ieps_53%": "0",
      "ieps_160%": "0",
      "archivo_xml": "F98C4F8C-0037-4388-B9EB-E9DDDCE2D893@2000000000XX0.xml",
      "direccion_emisor": "    ",
      "localidad_emisor": " ",
      "direccion_receptor": "    ",
      "localidad_receptor": " ",
      "iva_8%": 0,
      "ieps_30.4%": "0",
      "iva_ret_6%": "0",
      "regimenfiscalreceptor": "603 - Personas Morales con Fines no Lucrativos",
      "domiciliofiscalreceptor": "21100"
  }
]

export const recibidasPrueba = [
  {
      "verificado_ó_asoc.": "",
      "estado_sat": "Vigente",
      "version": "4.0",
      "tipo": "Factura",
      "fecha_emision": "01/10/2023",
      "fecha_timbrado": "2023-10-01T12:27:41",
      "estadopago": "",
      "fechapago": "",
      "serie": "",
      "folio": "012028004764145086",
      "uuid": "75E109B1-313A-40B0-9DCB-13707D960818",
      "uuid_relacion": "",
      "rfc_emisor": "BBA830831LJ2",
      "nombre_emisor": "BBVA MEXICO, S.A., INSTITUCION DE BANCA MULTIPLE, GRUPO FINANCIERO BBVA MEXICO",
      "lugardeexpedicion": "06600",
      "rfc_receptor": "GOMS651015HB4",
      "nombre_receptor": "SERGIO GOMEZ MARTINEZ",
      "residenciafiscal": "",
      "numregidtrib": "",
      "usocfdi": "G03 - Gastos en general",
      "subtotal": 0.01,
      "descuento": 0.01,
      "total_ieps": 0,
      "iva_16%": 0,
      "retenido_iva": 0,
      "retenido_isr": 0,
      "ish": 0,
      "total": 0,
      "totaloriginal": "",
      "total_trasladados": 0,
      "total_retenidos": 0,
      "total_localtrasladado": 0,
      "total_localretenido": 0,
      "complemento": "",
      "moneda": "MXN",
      "tipo_de_cambio": "",
      "formadepago": "03 - Transferencia electrónica de fondos",
      "metodo_de_pago": "PUE - Pago en una sola exhibición",
      "numctapago": "",
      "condicion_de_pago": "",
      "conceptos": "Servicios de Facturación * ",
      "combustible": "No",
      "ieps_3%": "0",
      "ieps_6%": "0",
      "ieps_7%": "0",
      "ieps_8%": "0",
      "ieps_9%": "0",
      "ieps_26.5%": "0",
      "ieps_30%": "0",
      "ieps_53%": "0",
      "ieps_160%": "0",
      "archivo_xml": "75E109B1-313A-40B0-9DCB-13707D960818@1000000000XX0.xml",
      "direccion_emisor": "    ",
      "localidad_emisor": " ",
      "direccion_receptor": "    ",
      "localidad_receptor": " ",
      "iva_8%": 0,
      "ieps_30.4%": "0",
      "iva_ret_6%": "0",
      "regimenfiscalreceptor": "612 - Personas Físicas con Actividades Empresariales y Profesionales",
      "domiciliofiscalreceptor": "22230"
  },
  {
      "verificado_ó_asoc.": "",
      "estado_sat": "Vigente",
      "version": "4.0",
      "tipo": "Factura",
      "fecha_emision": "02/10/2023",
      "fecha_timbrado": "2023-10-02T10:29:36",
      "estadopago": "",
      "fechapago": "",
      "serie": "a",
      "folio": "2317",
      "uuid": "E06630CA-8516-4EB0-BC65-322C1211BF62",
      "uuid_relacion": "",
      "rfc_emisor": "CGM1802096L8",
      "nombre_emisor": "CONTADORES GYA DE MONTERREY",
      "lugardeexpedicion": "64000",
      "rfc_receptor": "GOMS651015HB4",
      "nombre_receptor": "SERGIO GOMEZ MARTINEZ",
      "residenciafiscal": "",
      "numregidtrib": "",
      "usocfdi": "G03 - Gastos en general",
      "subtotal": 4000,
      "descuento": 0,
      "total_ieps": 0,
      "iva_16%": 640,
      "retenido_iva": 0,
      "retenido_isr": 0,
      "ish": 0,
      "total": 4640,
      "totaloriginal": "",
      "total_trasladados": 640,
      "total_retenidos": 0,
      "total_localtrasladado": 0,
      "total_localretenido": 0,
      "complemento": "",
      "moneda": "MXN",
      "tipo_de_cambio": "1",
      "formadepago": "99 - Por definir",
      "metodo_de_pago": "PPD - Pago en parcialidades o diferido",
      "numctapago": "",
      "condicion_de_pago": "",
      "conceptos": "Servicio de contabilidad correspondiente al mes de Septiembre del 2023 * ",
      "combustible": "No",
      "ieps_3%": "0",
      "ieps_6%": "0",
      "ieps_7%": "0",
      "ieps_8%": "0",
      "ieps_9%": "0",
      "ieps_26.5%": "0",
      "ieps_30%": "0",
      "ieps_53%": "0",
      "ieps_160%": "0",
      "archivo_xml": "E06630CA-8516-4EB0-BC65-322C1211BF62@1000000000XX0.xml",
      "direccion_emisor": "    ",
      "localidad_emisor": " ",
      "direccion_receptor": "    ",
      "localidad_receptor": " ",
      "iva_8%": 0,
      "ieps_30.4%": "0",
      "iva_ret_6%": "0",
      "regimenfiscalreceptor": "612 - Personas Físicas con Actividades Empresariales y Profesionales",
      "domiciliofiscalreceptor": "22230"
  },
  {
      "verificado_ó_asoc.": "",
      "estado_sat": "Vigente",
      "version": "4.0",
      "tipo": "Factura",
      "fecha_emision": "03/10/2023",
      "fecha_timbrado": "2023-10-03T13:14:56",
      "estadopago": "",
      "fechapago": "",
      "serie": "40",
      "folio": "362605",
      "uuid": "1F5C3374-ECE6-4568-B4A0-708123938DCE",
      "uuid_relacion": "",
      "rfc_emisor": "MRT790109FP1",
      "nombre_emisor": "MAYOREO DE REFACCIONES TIJUANA",
      "lugardeexpedicion": "22206",
      "rfc_receptor": "GOMS651015HB4",
      "nombre_receptor": "SERGIO GOMEZ MARTINEZ",
      "residenciafiscal": "",
      "numregidtrib": "",
      "usocfdi": "G03 - Gastos en general",
      "subtotal": 2361.72,
      "descuento": 0,
      "total_ieps": 0,
      "iva_16%": 0,
      "retenido_iva": 0,
      "retenido_isr": 0,
      "ish": 0,
      "total": 2550.66,
      "totaloriginal": "",
      "total_trasladados": 188.94,
      "total_retenidos": 0,
      "total_localtrasladado": 0,
      "total_localretenido": 0,
      "complemento": "",
      "moneda": "MXN",
      "tipo_de_cambio": "1",
      "formadepago": "28 - Tarjeta de débito",
      "metodo_de_pago": "PUE - Pago en una sola exhibición",
      "numctapago": "",
      "condicion_de_pago": "Contado",
      "conceptos": "ACUMULADOR LTH L47550 * ",
      "combustible": "No",
      "ieps_3%": "0",
      "ieps_6%": "0",
      "ieps_7%": "0",
      "ieps_8%": "0",
      "ieps_9%": "0",
      "ieps_26.5%": "0",
      "ieps_30%": "0",
      "ieps_53%": "0",
      "ieps_160%": "0",
      "archivo_xml": "1F5C3374-ECE6-4568-B4A0-708123938DCE@1000000000XX0.xml",
      "direccion_emisor": "    ",
      "localidad_emisor": " ",
      "direccion_receptor": "    ",
      "localidad_receptor": " ",
      "iva_8%": 188.94,
      "ieps_30.4%": "0",
      "iva_ret_6%": "0",
      "regimenfiscalreceptor": "612 - Personas Físicas con Actividades Empresariales y Profesionales",
      "domiciliofiscalreceptor": "22230"
  },
  {
      "verificado_ó_asoc.": "",
      "estado_sat": "Vigente",
      "version": "4.0",
      "tipo": "Factura",
      "fecha_emision": "09/10/2023",
      "fecha_timbrado": "2023-10-09T12:04:04",
      "estadopago": "",
      "fechapago": "",
      "serie": "",
      "folio": "",
      "uuid": "ACA01FF3-F0AA-448C-A6D8-C6117C4AFB08",
      "uuid_relacion": "",
      "rfc_emisor": "RAPA910131UM1",
      "nombre_emisor": "JOSE ALBERTO RAMIREZ PEREZ",
      "lugardeexpedicion": "83288",
      "rfc_receptor": "GOMS651015HB4",
      "nombre_receptor": "SERGIO GOMEZ MARTINEZ",
      "residenciafiscal": "",
      "numregidtrib": "",
      "usocfdi": "G03 - Gastos en general",
      "subtotal": 2500,
      "descuento": 0,
      "total_ieps": 0,
      "iva_16%": 400,
      "retenido_iva": 0,
      "retenido_isr": 0,
      "ish": 0,
      "total": 2900,
      "totaloriginal": "",
      "total_trasladados": 400,
      "total_retenidos": 0,
      "total_localtrasladado": 0,
      "total_localretenido": 0,
      "complemento": "",
      "moneda": "MXN",
      "tipo_de_cambio": "",
      "formadepago": "03 - Transferencia electrónica de fondos",
      "metodo_de_pago": "PUE - Pago en una sola exhibición",
      "numctapago": "",
      "condicion_de_pago": "",
      "conceptos": "revision ups de 6 kva * ",
      "combustible": "No",
      "ieps_3%": "0",
      "ieps_6%": "0",
      "ieps_7%": "0",
      "ieps_8%": "0",
      "ieps_9%": "0",
      "ieps_26.5%": "0",
      "ieps_30%": "0",
      "ieps_53%": "0",
      "ieps_160%": "0",
      "archivo_xml": "ACA01FF3-F0AA-448C-A6D8-C6117C4AFB08@1000000000XX0.xml",
      "direccion_emisor": "    ",
      "localidad_emisor": " ",
      "direccion_receptor": "    ",
      "localidad_receptor": " ",
      "iva_8%": 0,
      "ieps_30.4%": "0",
      "iva_ret_6%": "0",
      "regimenfiscalreceptor": "612 - Personas Físicas con Actividades Empresariales y Profesionales",
      "domiciliofiscalreceptor": "22230"
  },
  {
      "verificado_ó_asoc.": "",
      "estado_sat": "Vigente",
      "version": "4.0",
      "tipo": "Factura",
      "fecha_emision": "10/10/2023",
      "fecha_timbrado": "2023-10-10T20:23:25",
      "estadopago": "",
      "fechapago": "",
      "serie": "",
      "folio": "TX0002000003238",
      "uuid": "0406B8C5-6378-C040-A256-2D6920A25A64",
      "uuid_relacion": "",
      "rfc_emisor": "FLO181022CE5",
      "nombre_emisor": "FLORIFARMACIA",
      "lugardeexpedicion": "22237",
      "rfc_receptor": "GOMS651015HB4",
      "nombre_receptor": "SERGIO GOMEZ MARTINEZ",
      "residenciafiscal": "",
      "numregidtrib": "",
      "usocfdi": "G03 - Gastos en general",
      "subtotal": 538.4,
      "descuento": 0,
      "total_ieps": 0,
      "iva_16%": 0,
      "retenido_iva": 0,
      "retenido_isr": 0,
      "ish": 0,
      "total": 538.4,
      "totaloriginal": "",
      "total_trasladados": 0,
      "total_retenidos": 0,
      "total_localtrasladado": 0,
      "total_localretenido": 0,
      "complemento": "",
      "moneda": "MXN",
      "tipo_de_cambio": "",
      "formadepago": "28 - Tarjeta de débito",
      "metodo_de_pago": "PUE - Pago en una sola exhibición",
      "numctapago": "",
      "condicion_de_pago": "CONTADO",
      "conceptos": "BEDOYECTA TRI JGA 5 50000 * CENTRUM PERFORMANCE C 30 TABS. * ",
      "combustible": "No",
      "ieps_3%": "0",
      "ieps_6%": "0",
      "ieps_7%": "0",
      "ieps_8%": "0",
      "ieps_9%": "0",
      "ieps_26.5%": "0",
      "ieps_30%": "0",
      "ieps_53%": "0",
      "ieps_160%": "0",
      "archivo_xml": "0406B8C5-6378-C040-A256-2D6920A25A64@1000000000XX0.xml",
      "direccion_emisor": "    ",
      "localidad_emisor": " ",
      "direccion_receptor": "    ",
      "localidad_receptor": " ",
      "iva_8%": 0,
      "ieps_30.4%": "0",
      "iva_ret_6%": "0",
      "regimenfiscalreceptor": "612 - Personas Físicas con Actividades Empresariales y Profesionales",
      "domiciliofiscalreceptor": "22230"
  },
  {
      "verificado_ó_asoc.": "",
      "estado_sat": "Vigente",
      "version": "4.0",
      "tipo": "Factura",
      "fecha_emision": "10/10/2023",
      "fecha_timbrado": "2023-10-10T20:17:51",
      "estadopago": "",
      "fechapago": "",
      "serie": "",
      "folio": "TX0002000003237",
      "uuid": "4579BDA2-D873-B749-8968-354992EEA737",
      "uuid_relacion": "",
      "rfc_emisor": "FLO181022CE5",
      "nombre_emisor": "FLORIFARMACIA",
      "lugardeexpedicion": "22237",
      "rfc_receptor": "GOMS651015HB4",
      "nombre_receptor": "SERGIO GOMEZ MARTINEZ",
      "residenciafiscal": "",
      "numregidtrib": "",
      "usocfdi": "G03 - Gastos en general",
      "subtotal": 834,
      "descuento": 0,
      "total_ieps": 0,
      "iva_16%": 0,
      "retenido_iva": 0,
      "retenido_isr": 0,
      "ish": 0,
      "total": 834,
      "totaloriginal": "",
      "total_trasladados": 0,
      "total_retenidos": 0,
      "total_localtrasladado": 0,
      "total_localretenido": 0,
      "complemento": "",
      "moneda": "MXN",
      "tipo_de_cambio": "",
      "formadepago": "28 - Tarjeta de débito",
      "metodo_de_pago": "PUE - Pago en una sola exhibición",
      "numctapago": "",
      "condicion_de_pago": "CONTADO",
      "conceptos": "CONCOR 5MG GRAG C30 * ",
      "combustible": "No",
      "ieps_3%": "0",
      "ieps_6%": "0",
      "ieps_7%": "0",
      "ieps_8%": "0",
      "ieps_9%": "0",
      "ieps_26.5%": "0",
      "ieps_30%": "0",
      "ieps_53%": "0",
      "ieps_160%": "0",
      "archivo_xml": "4579BDA2-D873-B749-8968-354992EEA737@1000000000XX0.xml",
      "direccion_emisor": "    ",
      "localidad_emisor": " ",
      "direccion_receptor": "    ",
      "localidad_receptor": " ",
      "iva_8%": 0,
      "ieps_30.4%": "0",
      "iva_ret_6%": "0",
      "regimenfiscalreceptor": "612 - Personas Físicas con Actividades Empresariales y Profesionales",
      "domiciliofiscalreceptor": "22230"
  },
  {
      "verificado_ó_asoc.": "",
      "estado_sat": "Vigente",
      "version": "4.0",
      "tipo": "Factura",
      "fecha_emision": "12/10/2023",
      "fecha_timbrado": "2023-10-12T14:10:24",
      "estadopago": "",
      "fechapago": "",
      "serie": "EREFUG",
      "folio": "114944",
      "uuid": "83381244-391A-468A-B12F-563C9F80B6A7",
      "uuid_relacion": "",
      "rfc_emisor": "SFL0108131J2",
      "nombre_emisor": "SERVICIO FLORIDO",
      "lugardeexpedicion": "22237",
      "rfc_receptor": "GOMS651015HB4",
      "nombre_receptor": "SERGIO GOMEZ MARTINEZ",
      "residenciafiscal": "",
      "numregidtrib": "",
      "usocfdi": "G03 - Gastos en general",
      "subtotal": 596.32,
      "descuento": 0,
      "total_ieps": 0,
      "iva_16%": 0,
      "retenido_iva": 0,
      "retenido_isr": 0,
      "ish": 0,
      "total": 659.7,
      "totaloriginal": "",
      "total_trasladados": 63.38,
      "total_retenidos": 0,
      "total_localtrasladado": 0,
      "total_localretenido": 0,
      "complemento": "",
      "moneda": "MXN",
      "tipo_de_cambio": "",
      "formadepago": "01 - Efectivo",
      "metodo_de_pago": "PUE - Pago en una sola exhibición",
      "numctapago": "",
      "condicion_de_pago": "",
      "conceptos": "GASOLINA 87 OCTANOS * ",
      "combustible": "No",
      "ieps_3%": "0",
      "ieps_6%": "0",
      "ieps_7%": "0",
      "ieps_8%": "0",
      "ieps_9%": "0",
      "ieps_26.5%": "0",
      "ieps_30%": "0",
      "ieps_53%": "0",
      "ieps_160%": "0",
      "archivo_xml": "83381244-391A-468A-B12F-563C9F80B6A7@1000000000XX0.xml",
      "direccion_emisor": "    ",
      "localidad_emisor": " ",
      "direccion_receptor": "    ",
      "localidad_receptor": " ",
      "iva_8%": 47.71,
      "ieps_30.4%": "0",
      "iva_ret_6%": "0",
      "regimenfiscalreceptor": "612 - Personas Físicas con Actividades Empresariales y Profesionales",
      "domiciliofiscalreceptor": "22230"
  },
  {
      "verificado_ó_asoc.": "",
      "estado_sat": "Vigente",
      "version": "4.0",
      "tipo": "Factura",
      "fecha_emision": "17/10/2023",
      "fecha_timbrado": "2023-10-17T20:43:28",
      "estadopago": "",
      "fechapago": "",
      "serie": "DTLX",
      "folio": "18",
      "uuid": "5958F015-9CDA-428A-9F6E-E502807DA557",
      "uuid_relacion": "",
      "rfc_emisor": "AAGM9301195M1",
      "nombre_emisor": "MARIO ALEJANDRO ANDRADE GARCIA",
      "lugardeexpedicion": "22234",
      "rfc_receptor": "GOMS651015HB4",
      "nombre_receptor": "SERGIO GOMEZ MARTINEZ",
      "residenciafiscal": "",
      "numregidtrib": "",
      "usocfdi": "D01 - Honorarios médicos, dentales y gastos hospitalarios.",
      "subtotal": 550,
      "descuento": 0,
      "total_ieps": 0,
      "iva_16%": 0,
      "retenido_iva": 0,
      "retenido_isr": 0,
      "ish": 0,
      "total": 550,
      "totaloriginal": "",
      "total_trasladados": 0,
      "total_retenidos": 0,
      "total_localtrasladado": 0,
      "total_localretenido": 0,
      "complemento": "",
      "moneda": "MXN",
      "tipo_de_cambio": "",
      "formadepago": "28 - Tarjeta de débito",
      "metodo_de_pago": "PUE - Pago en una sola exhibición",
      "numctapago": "",
      "condicion_de_pago": "",
      "conceptos": "Ajuste de guarda * ",
      "combustible": "No",
      "ieps_3%": "0",
      "ieps_6%": "0",
      "ieps_7%": "0",
      "ieps_8%": "0",
      "ieps_9%": "0",
      "ieps_26.5%": "0",
      "ieps_30%": "0",
      "ieps_53%": "0",
      "ieps_160%": "0",
      "archivo_xml": "5958F015-9CDA-428A-9F6E-E502807DA557@1000000000XX0.xml",
      "direccion_emisor": "    ",
      "localidad_emisor": " ",
      "direccion_receptor": "    ",
      "localidad_receptor": " ",
      "iva_8%": 0,
      "ieps_30.4%": "0",
      "iva_ret_6%": "0",
      "regimenfiscalreceptor": "605 - Sueldos y Salarios e Ingresos Asimilados a Salarios",
      "domiciliofiscalreceptor": "22230"
  },
  {
      "verificado_ó_asoc.": "",
      "estado_sat": "Vigente",
      "version": "4.0",
      "tipo": "Factura",
      "fecha_emision": "17/10/2023",
      "fecha_timbrado": "2023-10-17T11:48:44",
      "estadopago": "",
      "fechapago": "",
      "serie": "EREFUG",
      "folio": "115707",
      "uuid": "5F821A75-52C9-49E3-BD98-F97C28EDA2DE",
      "uuid_relacion": "",
      "rfc_emisor": "SFL0108131J2",
      "nombre_emisor": "SERVICIO FLORIDO",
      "lugardeexpedicion": "22237",
      "rfc_receptor": "GOMS651015HB4",
      "nombre_receptor": "SERGIO GOMEZ MARTINEZ",
      "residenciafiscal": "",
      "numregidtrib": "",
      "usocfdi": "G03 - Gastos en general",
      "subtotal": 536.09,
      "descuento": 0,
      "total_ieps": 0,
      "iva_16%": 0,
      "retenido_iva": 0,
      "retenido_isr": 0,
      "ish": 0,
      "total": 593.07,
      "totaloriginal": "",
      "total_trasladados": 56.98,
      "total_retenidos": 0,
      "total_localtrasladado": 0,
      "total_localretenido": 0,
      "complemento": "",
      "moneda": "MXN",
      "tipo_de_cambio": "",
      "formadepago": "28 - Tarjeta de débito",
      "metodo_de_pago": "PUE - Pago en una sola exhibición",
      "numctapago": "",
      "condicion_de_pago": "",
      "conceptos": "GASOLINA 87 OCTANOS * ",
      "combustible": "No",
      "ieps_3%": "0",
      "ieps_6%": "0",
      "ieps_7%": "0",
      "ieps_8%": "0",
      "ieps_9%": "0",
      "ieps_26.5%": "0",
      "ieps_30%": "0",
      "ieps_53%": "0",
      "ieps_160%": "0",
      "archivo_xml": "5F821A75-52C9-49E3-BD98-F97C28EDA2DE@1000000000XX0.xml",
      "direccion_emisor": "    ",
      "localidad_emisor": " ",
      "direccion_receptor": "    ",
      "localidad_receptor": " ",
      "iva_8%": 42.89,
      "ieps_30.4%": "0",
      "iva_ret_6%": "0",
      "regimenfiscalreceptor": "612 - Personas Físicas con Actividades Empresariales y Profesionales",
      "domiciliofiscalreceptor": "22230"
  },
  {
      "verificado_ó_asoc.": "",
      "estado_sat": "Vigente",
      "version": "4.0",
      "tipo": "Factura",
      "fecha_emision": "19/10/2023",
      "fecha_timbrado": "2023-10-20T15:59:31",
      "estadopago": "",
      "fechapago": "",
      "serie": "FA",
      "folio": "000000000236656596",
      "uuid": "96CEA3E0-36F0-4B8B-89E2-9FBCDBFC3892",
      "uuid_relacion": "",
      "rfc_emisor": "RDI841003QJ4",
      "nombre_emisor": "RADIOMOVIL DIPSA",
      "lugardeexpedicion": "22320",
      "rfc_receptor": "GOMS651015HB4",
      "nombre_receptor": "SERGIO GOMEZ MARTINEZ",
      "residenciafiscal": "",
      "numregidtrib": "",
      "usocfdi": "G03 - Gastos en general",
      "subtotal": 309.84,
      "descuento": 69.32,
      "total_ieps": 0,
      "iva_16%": 38.48,
      "retenido_iva": 0,
      "retenido_isr": 0,
      "ish": 0,
      "total": 279,
      "totaloriginal": "",
      "total_trasladados": 38.48,
      "total_retenidos": 0,
      "total_localtrasladado": 0,
      "total_localretenido": 0,
      "complemento": "",
      "moneda": "MXN",
      "tipo_de_cambio": "",
      "formadepago": "99 - Por definir",
      "metodo_de_pago": "PPD - Pago en parcialidades o diferido",
      "numctapago": "",
      "condicion_de_pago": "",
      "conceptos": "Servicios de Telecomunicaciones * Cargo de equipo 08 de 24 * ",
      "combustible": "No",
      "ieps_3%": "0",
      "ieps_6%": "0",
      "ieps_7%": "0",
      "ieps_8%": "0",
      "ieps_9%": "0",
      "ieps_26.5%": "0",
      "ieps_30%": "0",
      "ieps_53%": "0",
      "ieps_160%": "0",
      "archivo_xml": "96CEA3E0-36F0-4B8B-89E2-9FBCDBFC3892@1000000000XX0.xml",
      "direccion_emisor": "    ",
      "localidad_emisor": " ",
      "direccion_receptor": "    ",
      "localidad_receptor": " ",
      "iva_8%": 0,
      "ieps_30.4%": "0",
      "iva_ret_6%": "0",
      "regimenfiscalreceptor": "612 - Personas Físicas con Actividades Empresariales y Profesionales",
      "domiciliofiscalreceptor": "22230"
  },
  {
      "verificado_ó_asoc.": "",
      "estado_sat": "Vigente",
      "version": "4.0",
      "tipo": "Factura",
      "fecha_emision": "20/10/2023",
      "fecha_timbrado": "2023-10-20T11:08:31",
      "estadopago": "",
      "fechapago": "",
      "serie": "2023",
      "folio": "202300814",
      "uuid": "5303B6D2-6F6B-11EE-AD9E-0D589E5CC1AA",
      "uuid_relacion": "",
      "rfc_emisor": "TME130726GD2",
      "nombre_emisor": "TEMPOEL MEXICO",
      "lugardeexpedicion": "03810",
      "rfc_receptor": "GOMS651015HB4",
      "nombre_receptor": "SERGIO GOMEZ MARTINEZ",
      "residenciafiscal": "",
      "numregidtrib": "",
      "usocfdi": "G03 - Gastos en general",
      "subtotal": 2181.6,
      "descuento": 0,
      "total_ieps": 0,
      "iva_16%": 349.06,
      "retenido_iva": 0,
      "retenido_isr": 0,
      "ish": 0,
      "total": 2530.66,
      "totaloriginal": "",
      "total_trasladados": 349.06,
      "total_retenidos": 0,
      "total_localtrasladado": 0,
      "total_localretenido": 0,
      "complemento": "",
      "moneda": "MXN",
      "tipo_de_cambio": "1",
      "formadepago": "03 - Transferencia electrónica de fondos",
      "metodo_de_pago": "PUE - Pago en una sola exhibición",
      "numctapago": "",
      "condicion_de_pago": "Pago Inmediato",
      "conceptos": "BAT. KAISE STANDARD VRLA 12V 50AH F1 * ",
      "combustible": "No",
      "ieps_3%": "0",
      "ieps_6%": "0",
      "ieps_7%": "0",
      "ieps_8%": "0",
      "ieps_9%": "0",
      "ieps_26.5%": "0",
      "ieps_30%": "0",
      "ieps_53%": "0",
      "ieps_160%": "0",
      "archivo_xml": "5303B6D2-6F6B-11EE-AD9E-0D589E5CC1AA@1000000000XX0.xml",
      "direccion_emisor": "    ",
      "localidad_emisor": " ",
      "direccion_receptor": "    ",
      "localidad_receptor": " ",
      "iva_8%": 0,
      "ieps_30.4%": "0",
      "iva_ret_6%": "0",
      "regimenfiscalreceptor": "612 - Personas Físicas con Actividades Empresariales y Profesionales",
      "domiciliofiscalreceptor": "22230"
  },
  {
      "verificado_ó_asoc.": "",
      "estado_sat": "Vigente",
      "version": "4.0",
      "tipo": "Factura",
      "fecha_emision": "21/10/2023",
      "fecha_timbrado": "2023-10-21T14:30:55",
      "estadopago": "",
      "fechapago": "",
      "serie": "EGOYIT",
      "folio": "117872",
      "uuid": "583CE2DB-52EF-4F5B-B4CA-66596C8B1B24",
      "uuid_relacion": "",
      "rfc_emisor": "EPI0103167Z2",
      "nombre_emisor": "ESTACION PIRU",
      "lugardeexpedicion": "22106",
      "rfc_receptor": "GOMS651015HB4",
      "nombre_receptor": "SERGIO GOMEZ MARTINEZ",
      "residenciafiscal": "",
      "numregidtrib": "",
      "usocfdi": "G03 - Gastos en general",
      "subtotal": 841.03,
      "descuento": 0,
      "total_ieps": 0,
      "iva_16%": 0,
      "retenido_iva": 0,
      "retenido_isr": 0,
      "ish": 0,
      "total": 931.84,
      "totaloriginal": "",
      "total_trasladados": 90.81,
      "total_retenidos": 0,
      "total_localtrasladado": 0,
      "total_localretenido": 0,
      "complemento": "",
      "moneda": "MXN",
      "tipo_de_cambio": "",
      "formadepago": "04 - Tarjeta de crédito",
      "metodo_de_pago": "PUE - Pago en una sola exhibición",
      "numctapago": "",
      "condicion_de_pago": "",
      "conceptos": "GASOLINA 87 OCTANOS * ",
      "combustible": "No",
      "ieps_3%": "0",
      "ieps_6%": "0",
      "ieps_7%": "0",
      "ieps_8%": "0",
      "ieps_9%": "0",
      "ieps_26.5%": "0",
      "ieps_30%": "0",
      "ieps_53%": "0",
      "ieps_160%": "0",
      "archivo_xml": "583CE2DB-52EF-4F5B-B4CA-66596C8B1B24@1000000000XX0.xml",
      "direccion_emisor": "    ",
      "localidad_emisor": " ",
      "direccion_receptor": "    ",
      "localidad_receptor": " ",
      "iva_8%": 67.28,
      "ieps_30.4%": "0",
      "iva_ret_6%": "0",
      "regimenfiscalreceptor": "612 - Personas Físicas con Actividades Empresariales y Profesionales",
      "domiciliofiscalreceptor": "22230"
  },
  {
      "verificado_ó_asoc.": "",
      "estado_sat": "Vigente",
      "version": "4.0",
      "tipo": "Factura",
      "fecha_emision": "22/10/2023",
      "fecha_timbrado": "2023-10-22T14:12:23",
      "estadopago": "",
      "fechapago": "",
      "serie": "I",
      "folio": "008426008173049018",
      "uuid": "BD9D98B5-0BB3-4B8F-ABC9-D003EAE85292",
      "uuid_relacion": "",
      "rfc_emisor": "BNM840515VB1",
      "nombre_emisor": "BANCO NACIONAL DE MEXICO",
      "lugardeexpedicion": "06000",
      "rfc_receptor": "GOMS651015HB4",
      "nombre_receptor": "SERGIO GOMEZ MARTINEZ",
      "residenciafiscal": "",
      "numregidtrib": "",
      "usocfdi": "S01",
      "subtotal": 0.01,
      "descuento": 0.01,
      "total_ieps": 0,
      "iva_16%": 0,
      "retenido_iva": 0,
      "retenido_isr": 0,
      "ish": 0,
      "total": 0,
      "totaloriginal": "",
      "total_trasladados": 0,
      "total_retenidos": 0,
      "total_localtrasladado": 0,
      "total_localretenido": 0,
      "complemento": "",
      "moneda": "MXN",
      "tipo_de_cambio": "1",
      "formadepago": "03 - Transferencia electrónica de fondos",
      "metodo_de_pago": "PUE - Pago en una sola exhibición",
      "numctapago": "",
      "condicion_de_pago": "",
      "conceptos": "Servicios de Facturación * ",
      "combustible": "No",
      "ieps_3%": "0",
      "ieps_6%": "0",
      "ieps_7%": "0",
      "ieps_8%": "0",
      "ieps_9%": "0",
      "ieps_26.5%": "0",
      "ieps_30%": "0",
      "ieps_53%": "0",
      "ieps_160%": "0",
      "archivo_xml": "BD9D98B5-0BB3-4B8F-ABC9-D003EAE85292@1000000000XX0.xml",
      "direccion_emisor": "    ",
      "localidad_emisor": " ",
      "direccion_receptor": "    ",
      "localidad_receptor": " ",
      "iva_8%": 0,
      "ieps_30.4%": "0",
      "iva_ret_6%": "0",
      "regimenfiscalreceptor": "616 - Sin obligaciones fiscales",
      "domiciliofiscalreceptor": "22230"
  },
  {
      "verificado_ó_asoc.": "",
      "estado_sat": "Vigente",
      "version": "4.0",
      "tipo": "Factura",
      "fecha_emision": "23/10/2023",
      "fecha_timbrado": "2023-10-23T04:02:46",
      "estadopago": "",
      "fechapago": "",
      "serie": "",
      "folio": "012028029807679054",
      "uuid": "8C479183-0F22-48DA-8AD8-B28BBB5F71F4",
      "uuid_relacion": "",
      "rfc_emisor": "BBA830831LJ2",
      "nombre_emisor": "BBVA MEXICO, S.A., INSTITUCION DE BANCA MULTIPLE, GRUPO FINANCIERO BBVA MEXICO",
      "lugardeexpedicion": "06600",
      "rfc_receptor": "GOMS651015HB4",
      "nombre_receptor": "SERGIO GOMEZ MARTINEZ",
      "residenciafiscal": "",
      "numregidtrib": "",
      "usocfdi": "G03 - Gastos en general",
      "subtotal": 500,
      "descuento": 0,
      "total_ieps": 0,
      "iva_16%": 80,
      "retenido_iva": 0,
      "retenido_isr": 0,
      "ish": 0,
      "total": 580,
      "totaloriginal": "",
      "total_trasladados": 80,
      "total_retenidos": 0,
      "total_localtrasladado": 0,
      "total_localretenido": 0,
      "complemento": "",
      "moneda": "MXN",
      "tipo_de_cambio": "",
      "formadepago": "03 - Transferencia electrónica de fondos",
      "metodo_de_pago": "PUE - Pago en una sola exhibición",
      "numctapago": "",
      "condicion_de_pago": "",
      "conceptos": "TOTAL COMISIONES * ",
      "combustible": "No",
      "ieps_3%": "0",
      "ieps_6%": "0",
      "ieps_7%": "0",
      "ieps_8%": "0",
      "ieps_9%": "0",
      "ieps_26.5%": "0",
      "ieps_30%": "0",
      "ieps_53%": "0",
      "ieps_160%": "0",
      "archivo_xml": "8C479183-0F22-48DA-8AD8-B28BBB5F71F4@1000000000XX0.xml",
      "direccion_emisor": "    ",
      "localidad_emisor": " ",
      "direccion_receptor": "    ",
      "localidad_receptor": " ",
      "iva_8%": 0,
      "ieps_30.4%": "0",
      "iva_ret_6%": "0",
      "regimenfiscalreceptor": "612 - Personas Físicas con Actividades Empresariales y Profesionales",
      "domiciliofiscalreceptor": "22230"
  },
  {
      "verificado_ó_asoc.": "",
      "estado_sat": "Vigente",
      "version": "4.0",
      "tipo": "Factura",
      "fecha_emision": "23/10/2023",
      "fecha_timbrado": "2023-10-24T10:35:54",
      "estadopago": "",
      "fechapago": "",
      "serie": "FA",
      "folio": "000000000237833014",
      "uuid": "E58A0218-621E-4B7D-839A-81888B6DC1CF",
      "uuid_relacion": "",
      "rfc_emisor": "RDI841003QJ4",
      "nombre_emisor": "RADIOMOVIL DIPSA",
      "lugardeexpedicion": "22320",
      "rfc_receptor": "GOMS651015HB4",
      "nombre_receptor": "SERGIO GOMEZ MARTINEZ",
      "residenciafiscal": "",
      "numregidtrib": "",
      "usocfdi": "G03 - Gastos en general",
      "subtotal": 348.26,
      "descuento": 22.4,
      "total_ieps": 0,
      "iva_16%": 52.14,
      "retenido_iva": 0,
      "retenido_isr": 0,
      "ish": 0,
      "total": 378,
      "totaloriginal": "",
      "total_trasladados": 52.14,
      "total_retenidos": 0,
      "total_localtrasladado": 0,
      "total_localretenido": 0,
      "complemento": "",
      "moneda": "MXN",
      "tipo_de_cambio": "",
      "formadepago": "99 - Por definir",
      "metodo_de_pago": "PPD - Pago en parcialidades o diferido",
      "numctapago": "",
      "condicion_de_pago": "",
      "conceptos": "Servicios de Telecomunicaciones * Cargo de equipo 24 de 24 * ",
      "combustible": "No",
      "ieps_3%": "0",
      "ieps_6%": "0",
      "ieps_7%": "0",
      "ieps_8%": "0",
      "ieps_9%": "0",
      "ieps_26.5%": "0",
      "ieps_30%": "0",
      "ieps_53%": "0",
      "ieps_160%": "0",
      "archivo_xml": "E58A0218-621E-4B7D-839A-81888B6DC1CF@1000000000XX0.xml",
      "direccion_emisor": "    ",
      "localidad_emisor": " ",
      "direccion_receptor": "    ",
      "localidad_receptor": " ",
      "iva_8%": 0,
      "ieps_30.4%": "0",
      "iva_ret_6%": "0",
      "regimenfiscalreceptor": "612 - Personas Físicas con Actividades Empresariales y Profesionales",
      "domiciliofiscalreceptor": "22230"
  },
  {
      "verificado_ó_asoc.": "",
      "estado_sat": "Vigente",
      "version": "4.0",
      "tipo": "Factura",
      "fecha_emision": "23/10/2023",
      "fecha_timbrado": "2023-10-23T23:03:48",
      "estadopago": "",
      "fechapago": "",
      "serie": "A",
      "folio": "202309-Z3141265101-17102023-538780",
      "uuid": "F8FB6558-E941-4A17-B1D6-7668CC632469",
      "uuid_relacion": "",
      "rfc_emisor": "IMS421231I45",
      "nombre_emisor": "INSTITUTO MEXICANO DEL SEGURO SOCIAL",
      "lugardeexpedicion": "06600",
      "rfc_receptor": "GOMS651015HB4",
      "nombre_receptor": "SERGIO GOMEZ MARTINEZ",
      "residenciafiscal": "",
      "numregidtrib": "",
      "usocfdi": "G03 - Gastos en general",
      "subtotal": 1370.41,
      "descuento": 0,
      "total_ieps": 0,
      "iva_16%": 0,
      "retenido_iva": 0,
      "retenido_isr": 0,
      "ish": 0,
      "total": 1370.41,
      "totaloriginal": "",
      "total_trasladados": 0,
      "total_retenidos": 0,
      "total_localtrasladado": 0,
      "total_localretenido": 0,
      "complemento": "",
      "moneda": "MXN",
      "tipo_de_cambio": "",
      "formadepago": "01 - Efectivo",
      "metodo_de_pago": "PUE - Pago en una sola exhibición",
      "numctapago": "",
      "condicion_de_pago": "",
      "conceptos": "Cuotas IMSS  * ",
      "combustible": "No",
      "ieps_3%": "0",
      "ieps_6%": "0",
      "ieps_7%": "0",
      "ieps_8%": "0",
      "ieps_9%": "0",
      "ieps_26.5%": "0",
      "ieps_30%": "0",
      "ieps_53%": "0",
      "ieps_160%": "0",
      "archivo_xml": "F8FB6558-E941-4A17-B1D6-7668CC632469@1000000000XX0.xml",
      "direccion_emisor": "    ",
      "localidad_emisor": " ",
      "direccion_receptor": "    ",
      "localidad_receptor": " ",
      "iva_8%": 0,
      "ieps_30.4%": "0",
      "iva_ret_6%": "0",
      "regimenfiscalreceptor": "612 - Personas Físicas con Actividades Empresariales y Profesionales",
      "domiciliofiscalreceptor": "22230"
  },
  {
      "verificado_ó_asoc.": "",
      "estado_sat": "Vigente",
      "version": "4.0",
      "tipo": "Factura",
      "fecha_emision": "25/10/2023",
      "fecha_timbrado": "2023-10-25T14:11:52",
      "estadopago": "",
      "fechapago": "",
      "serie": "EREFUG",
      "folio": "117093",
      "uuid": "C8381D36-12B9-4898-9A3C-D5219E988325",
      "uuid_relacion": "",
      "rfc_emisor": "SFL0108131J2",
      "nombre_emisor": "SERVICIO FLORIDO",
      "lugardeexpedicion": "22237",
      "rfc_receptor": "GOMS651015HB4",
      "nombre_receptor": "SERGIO GOMEZ MARTINEZ",
      "residenciafiscal": "",
      "numregidtrib": "",
      "usocfdi": "G03 - Gastos en general",
      "subtotal": 631.86,
      "descuento": 0,
      "total_ieps": 0,
      "iva_16%": 0,
      "retenido_iva": 0,
      "retenido_isr": 0,
      "ish": 0,
      "total": 699.02,
      "totaloriginal": "",
      "total_trasladados": 67.16,
      "total_retenidos": 0,
      "total_localtrasladado": 0,
      "total_localretenido": 0,
      "complemento": "",
      "moneda": "MXN",
      "tipo_de_cambio": "",
      "formadepago": "28 - Tarjeta de débito",
      "metodo_de_pago": "PUE - Pago en una sola exhibición",
      "numctapago": "",
      "condicion_de_pago": "",
      "conceptos": "GASOLINA 87 OCTANOS * ",
      "combustible": "No",
      "ieps_3%": "0",
      "ieps_6%": "0",
      "ieps_7%": "0",
      "ieps_8%": "0",
      "ieps_9%": "0",
      "ieps_26.5%": "0",
      "ieps_30%": "0",
      "ieps_53%": "0",
      "ieps_160%": "0",
      "archivo_xml": "C8381D36-12B9-4898-9A3C-D5219E988325@1000000000XX0.xml",
      "direccion_emisor": "    ",
      "localidad_emisor": " ",
      "direccion_receptor": "    ",
      "localidad_receptor": " ",
      "iva_8%": 50.55,
      "ieps_30.4%": "0",
      "iva_ret_6%": "0",
      "regimenfiscalreceptor": "612 - Personas Físicas con Actividades Empresariales y Profesionales",
      "domiciliofiscalreceptor": "22230"
  },
  {
      "verificado_ó_asoc.": "",
      "estado_sat": "Vigente",
      "version": "4.0",
      "tipo": "Factura",
      "fecha_emision": "27/10/2023",
      "fecha_timbrado": "2023-10-27T11:26:26",
      "estadopago": "",
      "fechapago": "",
      "serie": "2023",
      "folio": "202300835",
      "uuid": "F580E453-74ED-11EE-84E4-CBC717C1E970",
      "uuid_relacion": "",
      "rfc_emisor": "TME130726GD2",
      "nombre_emisor": "TEMPOEL MEXICO",
      "lugardeexpedicion": "03810",
      "rfc_receptor": "GOMS651015HB4",
      "nombre_receptor": "SERGIO GOMEZ MARTINEZ",
      "residenciafiscal": "",
      "numregidtrib": "",
      "usocfdi": "G03 - Gastos en general",
      "subtotal": 174037.09,
      "descuento": 0,
      "total_ieps": 0,
      "iva_16%": 27845.93,
      "retenido_iva": 0,
      "retenido_isr": 0,
      "ish": 0,
      "total": 201883.02,
      "totaloriginal": "",
      "total_trasladados": 27845.93,
      "total_retenidos": 0,
      "total_localtrasladado": 0,
      "total_localretenido": 0,
      "complemento": "",
      "moneda": "MXN",
      "tipo_de_cambio": "1",
      "formadepago": "03 - Transferencia electrónica de fondos",
      "metodo_de_pago": "PUE - Pago en una sola exhibición",
      "numctapago": "",
      "condicion_de_pago": "Pago Inmediato",
      "conceptos": "BAT. KAISE LONG LIFE VRLA 12V 75AH M8 * BAT. KAISE LONG LIFE VRLA 12V 75AH M8 * FLETE ENSENADA B.C.N * ",
      "combustible": "No",
      "ieps_3%": "0",
      "ieps_6%": "0",
      "ieps_7%": "0",
      "ieps_8%": "0",
      "ieps_9%": "0",
      "ieps_26.5%": "0",
      "ieps_30%": "0",
      "ieps_53%": "0",
      "ieps_160%": "0",
      "archivo_xml": "F580E453-74ED-11EE-84E4-CBC717C1E970@1000000000XX0.xml",
      "direccion_emisor": "    ",
      "localidad_emisor": " ",
      "direccion_receptor": "    ",
      "localidad_receptor": " ",
      "iva_8%": 0,
      "ieps_30.4%": "0",
      "iva_ret_6%": "0",
      "regimenfiscalreceptor": "612 - Personas Físicas con Actividades Empresariales y Profesionales",
      "domiciliofiscalreceptor": "22230"
  },
  {
      "verificado_ó_asoc.": "",
      "estado_sat": "Vigente",
      "version": "4.0",
      "tipo": "Factura",
      "fecha_emision": "28/10/2023",
      "fecha_timbrado": "2023-10-28T20:32:16",
      "estadopago": "",
      "fechapago": "",
      "serie": "EGOYIT",
      "folio": "118892",
      "uuid": "98062F7A-E9B0-41DC-920A-C35E43A1A2D9",
      "uuid_relacion": "",
      "rfc_emisor": "EPI0103167Z2",
      "nombre_emisor": "ESTACION PIRU",
      "lugardeexpedicion": "22106",
      "rfc_receptor": "GOMS651015HB4",
      "nombre_receptor": "SERGIO GOMEZ MARTINEZ",
      "residenciafiscal": "",
      "numregidtrib": "",
      "usocfdi": "G03 - Gastos en general",
      "subtotal": 853.09,
      "descuento": 0,
      "total_ieps": 0,
      "iva_16%": 0,
      "retenido_iva": 0,
      "retenido_isr": 0,
      "ish": 0,
      "total": 944.86,
      "totaloriginal": "",
      "total_trasladados": 91.77,
      "total_retenidos": 0,
      "total_localtrasladado": 0,
      "total_localretenido": 0,
      "complemento": "",
      "moneda": "MXN",
      "tipo_de_cambio": "",
      "formadepago": "01 - Efectivo",
      "metodo_de_pago": "PUE - Pago en una sola exhibición",
      "numctapago": "",
      "condicion_de_pago": "",
      "conceptos": "GASOLINA 87 OCTANOS * ",
      "combustible": "No",
      "ieps_3%": "0",
      "ieps_6%": "0",
      "ieps_7%": "0",
      "ieps_8%": "0",
      "ieps_9%": "0",
      "ieps_26.5%": "0",
      "ieps_30%": "0",
      "ieps_53%": "0",
      "ieps_160%": "0",
      "archivo_xml": "98062F7A-E9B0-41DC-920A-C35E43A1A2D9@1000000000XX0.xml",
      "direccion_emisor": "    ",
      "localidad_emisor": " ",
      "direccion_receptor": "    ",
      "localidad_receptor": " ",
      "iva_8%": 68.25,
      "ieps_30.4%": "0",
      "iva_ret_6%": "0",
      "regimenfiscalreceptor": "612 - Personas Físicas con Actividades Empresariales y Profesionales",
      "domiciliofiscalreceptor": "22230"
  },
  {
      "verificado_ó_asoc.": "",
      "estado_sat": "Vigente",
      "version": "4.0",
      "tipo": "Factura",
      "fecha_emision": "31/10/2023",
      "fecha_timbrado": "2023-10-31T13:32:52",
      "estadopago": "",
      "fechapago": "",
      "serie": "",
      "folio": "",
      "uuid": "6F6FB2A2-872E-436B-B4CB-2AD576B862CC",
      "uuid_relacion": "",
      "rfc_emisor": "RAPA910131UM1",
      "nombre_emisor": "JOSE ALBERTO RAMIREZ PEREZ",
      "lugardeexpedicion": "83288",
      "rfc_receptor": "GOMS651015HB4",
      "nombre_receptor": "SERGIO GOMEZ MARTINEZ",
      "residenciafiscal": "",
      "numregidtrib": "",
      "usocfdi": "G03 - Gastos en general",
      "subtotal": 5500,
      "descuento": 0,
      "total_ieps": 0,
      "iva_16%": 880,
      "retenido_iva": 0,
      "retenido_isr": 0,
      "ish": 0,
      "total": 6380,
      "totaloriginal": "",
      "total_trasladados": 880,
      "total_retenidos": 0,
      "total_localtrasladado": 0,
      "total_localretenido": 0,
      "complemento": "",
      "moneda": "MXN",
      "tipo_de_cambio": "",
      "formadepago": "03 - Transferencia electrónica de fondos",
      "metodo_de_pago": "PUE - Pago en una sola exhibición",
      "numctapago": "",
      "condicion_de_pago": "",
      "conceptos": "revision de ups de 6 kva * Mantenimieto preventivo ups de 15 kva * Mantenimiento preventivo ups de 20kva * Levantamiento ups de 30 kva * ",
      "combustible": "No",
      "ieps_3%": "0",
      "ieps_6%": "0",
      "ieps_7%": "0",
      "ieps_8%": "0",
      "ieps_9%": "0",
      "ieps_26.5%": "0",
      "ieps_30%": "0",
      "ieps_53%": "0",
      "ieps_160%": "0",
      "archivo_xml": "6F6FB2A2-872E-436B-B4CB-2AD576B862CC@1000000000XX0.xml",
      "direccion_emisor": "    ",
      "localidad_emisor": " ",
      "direccion_receptor": "    ",
      "localidad_receptor": " ",
      "iva_8%": 0,
      "ieps_30.4%": "0",
      "iva_ret_6%": "0",
      "regimenfiscalreceptor": "612 - Personas Físicas con Actividades Empresariales y Profesionales",
      "domiciliofiscalreceptor": "22230"
  },
  {
      "verificado_ó_asoc.": "",
      "estado_sat": "Vigente",
      "version": "4.0",
      "tipo": "Factura",
      "fecha_emision": "31/10/2023",
      "fecha_timbrado": "2023-10-31T19:05:45",
      "estadopago": "",
      "fechapago": "",
      "serie": "",
      "folio": "",
      "uuid": "AD8CAB0E-D9DA-4061-8CC9-B8A2C80EF8C3",
      "uuid_relacion": "",
      "rfc_emisor": "RAPA910131UM1",
      "nombre_emisor": "JOSE ALBERTO RAMIREZ PEREZ",
      "lugardeexpedicion": "83288",
      "rfc_receptor": "GOMS651015HB4",
      "nombre_receptor": "SERGIO GOMEZ MARTINEZ",
      "residenciafiscal": "",
      "numregidtrib": "",
      "usocfdi": "G03 - Gastos en general",
      "subtotal": 3200,
      "descuento": 0,
      "total_ieps": 0,
      "iva_16%": 512,
      "retenido_iva": 0,
      "retenido_isr": 0,
      "ish": 0,
      "total": 3712,
      "totaloriginal": "",
      "total_trasladados": 512,
      "total_retenidos": 0,
      "total_localtrasladado": 0,
      "total_localretenido": 0,
      "complemento": "",
      "moneda": "MXN",
      "tipo_de_cambio": "",
      "formadepago": "03 - Transferencia electrónica de fondos",
      "metodo_de_pago": "PUE - Pago en una sola exhibición",
      "numctapago": "",
      "condicion_de_pago": "",
      "conceptos": "cambio de baterias y mantenimiento ups 6 kva * ",
      "combustible": "No",
      "ieps_3%": "0",
      "ieps_6%": "0",
      "ieps_7%": "0",
      "ieps_8%": "0",
      "ieps_9%": "0",
      "ieps_26.5%": "0",
      "ieps_30%": "0",
      "ieps_53%": "0",
      "ieps_160%": "0",
      "archivo_xml": "AD8CAB0E-D9DA-4061-8CC9-B8A2C80EF8C3@1000000000XX0.xml",
      "direccion_emisor": "    ",
      "localidad_emisor": " ",
      "direccion_receptor": "    ",
      "localidad_receptor": " ",
      "iva_8%": 0,
      "ieps_30.4%": "0",
      "iva_ret_6%": "0",
      "regimenfiscalreceptor": "612 - Personas Físicas con Actividades Empresariales y Profesionales",
      "domiciliofiscalreceptor": "22230"
  },
  {
      "verificado_ó_asoc.": "",
      "estado_sat": "Vigente",
      "version": "4.0",
      "tipo": "Factura",
      "fecha_emision": "31/10/2023",
      "fecha_timbrado": "2023-10-31T13:36:25",
      "estadopago": "",
      "fechapago": "",
      "serie": "",
      "folio": "",
      "uuid": "FE27EC83-BB2F-4EE0-A9B3-F90CB69E7C73",
      "uuid_relacion": "",
      "rfc_emisor": "RAPA910131UM1",
      "nombre_emisor": "JOSE ALBERTO RAMIREZ PEREZ",
      "lugardeexpedicion": "83288",
      "rfc_receptor": "GOMS651015HB4",
      "nombre_receptor": "SERGIO GOMEZ MARTINEZ",
      "residenciafiscal": "",
      "numregidtrib": "",
      "usocfdi": "G03 - Gastos en general",
      "subtotal": 2500,
      "descuento": 0,
      "total_ieps": 0,
      "iva_16%": 400,
      "retenido_iva": 0,
      "retenido_isr": 0,
      "ish": 0,
      "total": 2900,
      "totaloriginal": "",
      "total_trasladados": 400,
      "total_retenidos": 0,
      "total_localtrasladado": 0,
      "total_localretenido": 0,
      "complemento": "",
      "moneda": "MXN",
      "tipo_de_cambio": "",
      "formadepago": "03 - Transferencia electrónica de fondos",
      "metodo_de_pago": "PUE - Pago en una sola exhibición",
      "numctapago": "",
      "condicion_de_pago": "",
      "conceptos": "revision de ups de 6 kva * ",
      "combustible": "No",
      "ieps_3%": "0",
      "ieps_6%": "0",
      "ieps_7%": "0",
      "ieps_8%": "0",
      "ieps_9%": "0",
      "ieps_26.5%": "0",
      "ieps_30%": "0",
      "ieps_53%": "0",
      "ieps_160%": "0",
      "archivo_xml": "FE27EC83-BB2F-4EE0-A9B3-F90CB69E7C73@1000000000XX0.xml",
      "direccion_emisor": "    ",
      "localidad_emisor": " ",
      "direccion_receptor": "    ",
      "localidad_receptor": " ",
      "iva_8%": 0,
      "ieps_30.4%": "0",
      "iva_ret_6%": "0",
      "regimenfiscalreceptor": "612 - Personas Físicas con Actividades Empresariales y Profesionales",
      "domiciliofiscalreceptor": "22230"
  }
]

export const RegimenFiscalInfo = [
  {
      clave: 605,
      nombre: "Sueldos y Salarios e Ingresos Asimilados a Salarios"
  },
  {
      clave: 606,
      nombre: "Arrendamiento"
  },
  {
      clave: 608,
      nombre: "Demás Ingresos"
  },
  {
      clave: 611,
      nombre: "Ingresos por Dividendos (socios y accionistas)"
  },
  {
      clave: 612,
      nombre: "Personas Físicas con Actividades Empresariales y Profesionales"
  },
  {
      clave: 614,
      nombre: "Ingresos por intereses"
  },
  {
      clave: 615,
      nombre: "Régimen de los ingresos por obtención de premios"
  },
  {
      clave: 616,
      nombre: "Sin obligaciones fiscales"
  },
  {
      clave: 621,
      nombre: "Información Fiscal"
  },
  {
      clave: 622,
      nombre: "Actividades Agrícolas, Ganaderas, Silvícolas y Pesqueras"
  },
  {
      clave: 626,
      nombre: "Régimen Simplificado de Confianza"
  },
  {
      clave: 629,
      nombre: "De los Regímenes Fiscales Preferentes y de las Empresas Multinacionales"
  },
  {
      clave: 630,
      nombre: "Enajenación de acciones en bolsa de valores"
  }
]

export const MetodoDePago = [
  {
    clave: "PUE",
    nombre: "Pago en una sola Exhibicion"
  },
  {
    clave: "PIP",
    nombre: "Pago Inicial y en parcialidades"
  },
  {
    clave: "PPD",
    nombre: "Pago en parcialidades o diferido"
  }
]

export const FormaDePago = [
  {
    clave: "01",
    nombre: "Efectivo"
  },
  {
    clave: "02",
    nombre: "Cheque nominativo"
  },
  {
    clave: "03",
    nombre: "Transferencia electrónica de fondos"
  },
  {
    clave: "04",
    nombre: "Tarjeta de crédito"
  },
  {
    clave: "05",
    nombre: "Monedero electrónico"
  },
  {
    clave: "06",
    nombre: "Dinero electrónico"
  },
  {
    clave: "08",
    nombre: "Vales de despensa"
  },
  {
    clave: "12",
    nombre: "Dación de pago"
  },
  {
    clave: "13",
    nombre: "Pago por subrogación"
  },
  {
    clave: "14",
    nombre: "Pago por consignación"
  },
  {
    clave: "15",
    nombre: "Condonación"
  },
  {
    clave: "17",
    nombre: "Compensación"
  },
  {
    clave: "23",
    nombre: "Novación"
  },
  {
    clave: "24",
    nombre: "Confisión"
  },
  {
    clave: "25",
    nombre: "Remisión de deuda"
  },
  {
    clave: "26",
    nombre: "Prescripción o caducidad"
  },

  {
    clave: "27",
    nombre: "A satisfacción de acreedor"
  },
  {
    clave: "28",
    nombre: "Tarjeta de débito"
  },
  {
    clave: "29",
    nombre: "Tarjeta de servicios"
  },
  {
    clave: "30",
    nombre: "Aplicación de anticipos"
  },
  {
    clave: "31",
    nombre: "Intermediario pagos"
  },
  {
    clave: "99",
    nombre: "Por definir"
  },
]

export const Moneda = [
  {
    clave: 'MXN',
    nombre: "Peso Mexicano"
  },
  {
    clave: "USD",
    nombre: "Dolar Americano"
  }
]

export const TipoDePago = [
  {
    clave: "E",
    nombre: "Egreso"
  },
  {
    clave: "P",
    nombre: "Pago"
  },
  {
    clave: "I",
    nombre: "Ingreso"
  },
]

export const UsoCDFI = [
  {
    clave: "G01",
    nombre: "Adquisición de mercancías"
  },
  {
    clave: "G02",
    nombre: "Devoluciones, descuentos o bonificaciones"
  },
  {
    clave: "G03",
    nombre: "Gastos en general"
  },
  {
    clave: "I01",
    nombre: "Construcciones"
  },

  {
    clave: "I02",
    nombre: "Mobiliario y equipo de oficina por inversiones"
  },
  {
    clave: "I03",
    nombre: "Equipo de transporte"
  },
  {
    clave: "I04",
    nombre: "Equipo de cómputo y accesorios"
  },
  {
    clave: "I05",
    nombre: "Dados, troqueles, moldes, matrices y herramental"
  },
  {
    clave: "I06",
    nombre: "Comunicaciones telefónicas"
  },
  {
    clave: "I07",
    nombre: "Comunicaciones satelitales"
  },
  {
    clave: "I08",
    nombre: "Otra maquinaria y equipo"
  },
  {
    clave: "D01",
    nombre: "Honorarios médicos, dentales y gastos hospitalarios."
  },
  {
    clave: "D02",
    nombre: "Gastos médicos por incapacidad o discapacidad"
  },
  {
    clave: "D03",
    nombre: "Gastos funerales."
  },
  {
    clave: "D04",
    nombre: "Donativos"
  },
  {
    clave: "D05",
    nombre: "Intereses reales efectivamente pagados por créditos hipotecarios (casa habitación)."
  },
  {
    clave: "D06",
    nombre: "Aportaciones voluntarias al SAR."
  },
  {
    clave: "D07",
    nombre: "Primas por seguros de gastos médicos."
  },
  {
    clave: "D08",
    nombre: "Gastos de transportación escolar obligatoria."
  },
  {
    clave: "D09",
    nombre: "Depósitos en cuentas para el ahorro, primas que tengan como base planes de pensiones."
  },
  {
    clave: "D10",
    nombre: "Pagos por servicios educativos (colegiaturas)"
  },
  {
    clave: "CP01",
    nombre: "Pagos"
  },
  {
    clave: "CN01",
    nombre: "Nómina"
  },

  {
    clave: "S01",
    nombre: "Sin Efectos Fiscales"
  },
]

export const CatUniData = [
  {
    clave: "H87",
    nombre: "Pieza"
  },
  {
    clave: "E48",
    nombre: "Unidad de Servicio"
  },
  {
    clave: "EA",
    nombre: "Elemento"
  },
  {
    clave: "ACT",
    nombre: "Actividad"
  },
  {
    clave: "KGM",
    nombre: "Kilogramo"
  },
  {
    clave: "E51",
    nombre: "Trabajo"
  },
  {
    clave: "A9",
    nombre: "Tarifa"
  },
  {
    clave: "MTR",
    nombre: "Metro"
  },
  {
    clave: "AB",
    nombre: "Paquete a granel"
  },
  {
    clave: "BB",
    nombre: "Caja base"
  },
  {
    clave: "KT",
    nombre: "Kit"
  },
  {
    clave: "SET",
    nombre: "Conjunto"
  },
  {
    clave: "LTR",
    nombre: "Litro"
  },
  {
    clave: "XBX",
    nombre: "Caja"
  },
  {
    clave: "MON",
    nombre: "Mes"
  },
  {
    clave: "HUR",
    nombre: "Hora"
  },
  {
    clave: "MTK",
    nombre: "Metro cuadrado"
  },
  {
    clave: "11",
    nombre: "Equipos"
  },
  {
    clave: "MGM",
    nombre: "Miligramo"
  },
  {
    clave: "XPK",
    nombre: "Paquete"
  },
  {
    clave: "XKI",
    nombre: "Kit (Conjunto de piezas)"
  },
  {
    clave: "AS",
    nombre: "Variedad"
  },
  {
    clave: "GRM",
    nombre: "Gramo"
  },
  {
    clave: "PR",
    nombre: "Par"
  },
  {
    clave: "DPC",
    nombre: "Docenas de piezas"
  },
  {
    clave: "xun",
    nombre: "Unidad"
  },
  {
    clave: "DAY",
    nombre: "Día"
  },
  {
    clave: "XLT",
    nombre: "Lote"
  },
  {
    clave: "10",
    nombre: "Grupos"
  },
  {
    clave: "MLT",
    nombre: "Mililitro"
  },
  {
    clave: "E54",
    nombre: "Viaje"
  },
]